{
  "id": "wrq",
  "title": "Test worktree merge flow v2",
  "description": "Manual test of worktree merge to feature branch",
  "status": "closed",
  "priority": 2,
  "type": "epic",
  "owner": "morten@elk.dk",
  "created_by": "morten@elk.dk",
  "created_at": "2026-01-24T14:18:57.0529489Z",
  "updated_at": "2026-01-24T14:19:57.0029504Z",
  "closed_at": "2026-01-24T14:19:57.0029504Z",
  "closed_reason": "Test complete"
}