{
  "id": "i69",
  "title": "Add read operation wrappers to stores/comms.ts",
  "description": "Add convenience wrapper functions to stores/comms.ts:\n\n- fetchInfo(): Promise\u003cInfoResponse\u003e\n- fetchTickDetails(id): Promise\u003cTickDetail\u003e\n- fetchActivity(limit?): Promise\u003cActivity[]\u003e\n- fetchRecord(tickId): Promise\u003cRunRecord | null\u003e\n- fetchRunStatus(epicId): Promise\u003cRunStatusResponse\u003e\n- fetchContext(epicId): Promise\u003cstring | null\u003e\n\nEach wrapper calls getCommsClient() and delegates to the client method.\nExport these from stores/index.ts.",
  "status": "closed",
  "priority": 2,
  "type": "task",
  "owner": "peter@engelbrecht.dk",
  "blocked_by": [
    "r3h",
    "ewm",
    "5xl"
  ],
  "parent": "pxm",
  "acceptance_criteria": "Wrappers compile and are exported from stores/index.ts",
  "created_by": "peter@engelbrecht.dk",
  "created_at": "2026-01-25T10:10:32.293855Z",
  "updated_at": "2026-01-25T10:25:17.809025Z",
  "closed_at": "2026-01-25T10:25:17.809025Z",
  "closed_reason": "Added 6 read operation wrappers to stores/comms.ts and exported from stores/index.ts"
}