{
  "id": "1sp",
  "title": "Implement beads benchmarks",
  "description": "Write scripts/commands to measure beads list/ready/create/update performance.",
  "notes": "2026-01-16 15:11 - (from: human) this is a test",
  "status": "closed",
  "priority": 2,
  "type": "task",
  "owner": "pengelbrecht",
  "parent": "pjp",
  "created_by": "pengelbrecht",
  "created_at": "2026-01-08T21:09:14.571268Z",
  "updated_at": "2026-01-16T15:11:50.85204+01:00",
  "closed_at": "2026-01-09T08:58:52.224995Z",
  "closed_reason": "Added beads benchmark script."
}