{
  "id": "ewm",
  "title": "Implement read operations in CloudCommsClient",
  "description": "Implement the 6 read operations in comms/cloud.ts:\n\n- fetchInfo() -\u003e Return {repoName: projectId, epics: []} (epics computed from ticks)\n- fetchTick(id) -\u003e Return from cache with parseNotes() and computed blockerDetails\n- fetchActivity(limit) -\u003e Return [] (not supported in cloud mode yet)\n- fetchRecord(tickId) -\u003e Return null (not supported in cloud mode yet)\n- fetchRunStatus(epicId) -\u003e Derive from current run event state\n- fetchContext(epicId) -\u003e Return null (not supported in cloud mode yet)\n\nAdd tests to cloud.test.ts for these operations.",
  "status": "closed",
  "priority": 2,
  "type": "task",
  "owner": "peter@engelbrecht.dk",
  "blocked_by": [
    "nsk"
  ],
  "parent": "pxm",
  "acceptance_criteria": "All new cloud.test.ts tests pass",
  "created_by": "peter@engelbrecht.dk",
  "created_at": "2026-01-25T10:10:14.459544Z",
  "updated_at": "2026-01-25T10:23:44.444934Z",
  "closed_at": "2026-01-25T10:23:44.444934Z",
  "closed_reason": "Implemented 6 read operations in CloudCommsClient with tick cache and run state tracking, 28 unit tests passing"
}