{
  "id": "v84",
  "title": "Implement wave runner with parallel agent spawning",
  "description": "Create the core wave execution function that spawns parallel Claude agents for all tasks in a wave and collects results.\n\nImplementation:\n- runWave(ctx, wave, workDir) []TaskResult\n- Spawns one goroutine per task in the wave\n- Each goroutine calls agent.Run() with WorkDir set to worktree path\n- Each agent gets a StateCallback that writes per-task .live.json via runrecord.WriteLive()\n- Collects results (output, cost, tokens, signals) per task\n- Respects context cancellation for graceful shutdown\n- Parses signals from agent output (reuse existing ParseSignals from engine/signals.go)\n\nThis replaces both pool mode (mutex-based task claiming) and swarm mode (Claude-as-orchestrator).",
  "status": "closed",
  "priority": 2,
  "type": "task",
  "owner": "peter@engelbrecht.dk",
  "blocked_by": [
    "o58"
  ],
  "parent": "757",
  "acceptance_criteria": "runWave() spawns parallel agents and returns per-task results. Board receives per-task live updates via .live.json files. Signal parsing works on wave results. Tests cover: single task wave, multi-task wave, context cancellation, signal detection.",
  "created_by": "peter@engelbrecht.dk",
  "created_at": "2026-03-25T07:53:40.466796Z",
  "updated_at": "2026-03-25T08:03:37.590769Z",
  "closed_at": "2026-03-25T08:03:37.590769Z",
  "closed_reason": "Wave runner implemented with parallel agent spawning, signal parsing, and live record updates."
}